Title, Work Item Type, Assigned To, Iteration Path, State
Set Up Project Repository, Task, Ren, World Papers\Sprint 1, New
Design Basic Application Architecture, Task, Ren, World Papers\Sprint 1, New
Implement Web Scraping Module, Task, Ren, World Papers\Sprint 1, New
Integrate Translation Service, Task, Ren, World Papers\Sprint 1, New
Set Up Basic Data Storage, Task, Ren, World Papers\Sprint 1, New
Develop Basic User Interface, Task, Ren, World Papers\Sprint 1, New
Configure Deployment Pipeline, Task, Ren, World Papers\Sprint 1, New